<?xml version="1.0" encoding="UTF-8" standalone="yes"?>
<events xmlns="http://com/meriosol/etr/schema"
        xmlns:xsi="http://www.w3.org/2001/XMLSchema-instance"
        xsi:schemaLocation="http://com/meriosol/etr/schema etr_prototype.xsd">
    <event id="1000001" severity="INFO" created="2014-04-04T01:02:03.231Z">
        <event-category code="MESSAGE">
            <name>Message</name>
        </event-category>
        <source>SRC1</source>
        <process-id>PRC1</process-id>
        <title>Some INFO message</title>
    </event>
    <event id="1000001" severity="WARN_WRONG" created="2014-04-04T01:02--04.234Z">
        <event-category code="MESSAGE"/>
        <source>SRC2</source>
        <process-id>PRC 2</process-id>
        <title>Some WARN message</title>
    </event>
    <event severity="INFO" created="2014-04-04T01:16:04.234Z">
        <event-category code="MESSAGE"/>
        <source>SRC3</source>
        <process-id>PRC_3</process-id>
    </event>
</events>